SYMBOL,NAME,LAST PRICE,NET CHANGE,% CHANGE,DELTA,1 yr % CHANGE
PMSE,PGIM Rock ETF Trust PGIM S&P 500 Max Buffer ETF - September,$26.2009,0.0330,0.12608413250296108%,up,4.80%
PNOV,Innovator U.S. Equity Power Buffer ETF - November,$44.0300,0.0500,0.11371389583807141%,up,15.23%
PNQI,Invesco NASDAQ Internet ETF,$48.1723,-0.1395,-0.2899605071710663%,down,-1.15%
POCT,Innovator U.S. Equity Power Buffer ETF - October,$46.0200,0.0177,0.03850337176419404%,up,15.30%
PONX,Investment Managers Series Trust II Tradr 2X Long PONY Daily E,$5.6600,0.2184,3.8192501398992724%,up,-80.32%
POWA,Invesco Bloomberg Pricing Power ETF,$87.1456,-0.1278,-0.14745586708203529%,down,2.66%
POWR,iShares U.S. Power Infrastructure ETF,$27.7500,0.2700,0.984323733138899%,up,19.42%
PPA,Invesco Aerospace & Defense ETF,$170.2400,-0.2600,-0.15482641576847495%,down,28.97%
PPEM,Putnam ETF Trust Putnam PanAgora ESG Emerging Markets Equity E,$22.5804,0.2502,1.1131774944163157%,up,-3.06%
PPH,VanEck Pharmaceutical ETF,$104.9900,1.2000,1.1560693641618498%,up,20.40%
PPI,Astoria Real Assets ETF,$21.7841,0.0371,0.17059745897154102%,up,41.12%
PPIE,Putnam ETF Trust Putnam PanAgora ESG International Equity ETF,$27.9727,0.2422,0.8596456357544437%,up,9.01%
PPLT,abrdn Physical Platinum Shares ETF,$17.4700,0.1400,0.7843137254901961%,up,80.56%
PPTY,U.S. Diversified Real Estate ETF,$33.0514,0.0881,0.2671477955000303%,up,10.59%
PQAP,PGIM Nasdaq-100 Buffer 12 ETF - April,$31.8800,0.0858,0.26942328344711075%,up,22.30%
PQDI,Principal Spectrum Preferred and Income ETF,$19.3851,0.0085,0.04388569068332602%,up,1.91%
PQJA,PGIM Nasdaq-100 Buffer 12 ETF - January,$31.4550,0.0850,0.27065753860850184%,up,23.65%
PQJL,PGIM Nasdaq-100 Buffer 12 ETF - July,$30.9650,0.0900,0.29088558500323203%,up,21.41%
PQOC,PGIM Nasdaq-100 Buffer 12 ETF - October,$30.9550,0.0900,0.29135642602784073%,up,21.45%
PRAE,Northern Lights Fund Trust III PlanRock Alternative Growth ETF,$40.4055,0.1268,0.31514067004672436%,up,32.19%
PRAY,FIS Trust FIS Christian Stock Fund,$35.1760,-0.0057,-0.016122827661115134%,down,20.25%
PRCS,Parnassus Income Funds Parnassus Core Select ETF,$27.6500,0.0028,0.010126582278481013%,up,14.11%
PREF,Principal Spectrum Preferred Securities Active ETF,$18.9700,0.0050,0.02640612622128334%,up,1.37%
PRF,Invesco RAFI US 1000 ETF,$53.2100,0.1600,0.30297292179511454%,up,30.78%
PRFD,PIMCO U.S. Treasury Index Fund PIMCO Preferred and Capital Sec,$50.9900,0.1036,0.20363636363636362%,up,2.04%
PRFZ,Invesco RAFI US 1500 Small-Mid ETF,$51.1840,0.3419,0.6737649449105029%,up,31.26%
PRIV,State Street IG Public & Private Credit ETF,$25.0087,-0.0007,-0.0027995184828209546%,down,1.79%
PRMR,PeakShares RMR Prime Equity ETF,$26.7335,0.1878,0.706971841590122%,up,6.34%
PRN,Invesco Dorsey Wright Industrials Momentum ETF,$236.7747,0.4927,0.21080825519479549%,up,60.48%
PRNT,3D Printing (The) ETF,$25.2600,0.2437,0.9971358428805237%,up,15.13%
PRVS,Parnassus Income Funds Parnassus Value Select ETF,$30.4787,0.0850,0.27887139107611547%,up,30.62%
PRXG,Praxis Funds Praxis Impact Large Cap Growth ETF,$39.4700,0.0697,0.17672413793103448%,up,29.21%
PRXV,Praxis Funds Praxis Impact Large Cap Value ETF,$33.5370,0.0773,0.23224372070664584%,up,22.39%
PSC,Principal U.S. Small-Cap ETF,$64.5092,0.0326,0.05098322558044246%,up,26.59%
PSCC,Invesco S&P SmallCap Consumer Staples ETF,$32.9850,0.2082,0.636100052855576%,up,-6.75%
PSCD,Invesco S&P SmallCap Consumer Discretionary ETF,$105.4210,1.5539,1.4861110446961838%,up,8.92%
PSCE,Invesco S&P SmallCap Energy ETF,$62.7353,-0.9157,-1.4621979436294508%,down,70.08%
PSCF,Invesco S&P SmallCap Financials ETF,$61.5520,0.1482,0.240265751430327%,up,18.73%
PSCH,Invesco S&P SmallCap Health Care ETF,$44.7300,-0.2043,-0.4531842683170293%,down,11.84%
PSCI,Invesco S&P SmallCap Industrials ETF,$168.0614,0.3723,0.22415166452027754%,up,32.83%
PSCJ,Pacer Swan SOS Conservative (July) ETF,$31.4300,0.0200,0.06371455877668047%,up,17.23%
PSCM,Invesco S&P SmallCap Materials ETF,$102.1038,0.1315,0.13037551121576405%,up,54.01%
PSCQ,Pacer Swan SOS Conservative (October) ETF,$30.9540,0.0482,0.15592347457023997%,up,16.12%
PSCT,Invesco S&P SmallCap Information Technology ETF,$83.2000,0.8800,1.0911345319280843%,up,88.39%
PSCU,Invesco S&P SmallCap Utilities & Communication Services ETF,$64.2400,0.0565,0.08866889934432096%,up,16.68%
PSCW,Pacer Swan SOS Conservative (April) ETF,$29.8300,-0.0100,-0.0335795836131632%,down,15.34%
PSCX,Pacer Swan SOS Conservative (January) ETF,$32.4450,0.0250,0.07718431614695893%,up,16.16%
PSDM,PGIM ETF Trust PGIM Short Duration Multi-Sector Bond ETF,$51.1000,0.0150,0.02935995302407516%,up,0.41%
PSEP,Innovator U.S. Equity Power Buffer ETF - September,$45.6600,0.0500,0.10960105217010084%,up,15.58%
PSET,Principal Quality ETF,$75.4522,-0.0765,-0.10198191520703662%,down,7.19%
PSFD,Pacer Swan SOS Flex (January) ETF,$39.5417,0.0624,0.15817490494296574%,up,18.33%
PSFF,Pacer Swan SOS Fund of Funds ETF,$34.0327,0.0000,0%,unch,15.70%
PSFJ,Pacer Swan SOS Flex (July) ETF,$34.8549,0.0450,0.12916188289322617%,up,18.72%
PSFM,Pacer Swan SOS Flex (April) ETF,$34.5750,0.0500,0.1446340757882557%,up,17.98%
PSFO,Pacer Swan SOS Flex (October) ETF,$34.3419,0.0427,0.12460786459473264%,up,18.41%
PSH,PGIM ETF Trust PGIM Short Duration High Yield ETF,$50.0650,0.1023,0.204304575583706%,up,-0.02%
PSI,Invesco Semiconductors ETF,$153.7500,1.6100,1.0682059447983014%,up,189.35%
PSIL,AdvisorShares Psychedelics ETF,$21.1300,0.5794,2.833141001819%,up,62.47%
PSK,State Street SPDR ICE Preferred Securities ETF,$30.9700,-0.1227,-0.3972506499435043%,down,-1.13%
PSL,Invesco Dorsey Wright Consumer Staples Momentum ETF,$111.2295,-0.7241,-0.6522083752166221%,down,0.05%
PSLV,Sprott Physical Silver Trust ETV,$24.2400,0.1900,0.7701661937576003%,up,119.09%
PSMD,Pacer Swan SOS Moderate (January) ETF,$34.0911,0.0351,0.10312913177611283%,up,15.79%
PSMJ,Pacer Swan SOS Moderate (July) ETF,$33.5650,0.0201,0.05993720012762747%,up,16.99%
PSMO,Pacer Swan SOS Moderate (October) ETF,$32.2846,0.0250,0.07757951900698215%,up,15.78%
PSMR,Pacer Swan SOS Moderate (April) ETF,$31.9650,0.0386,0.1208568941656804%,up,15.39%
PSP,Invesco Global Listed Private Equity ETF,$60.6000,0.7900,1.2991284328235486%,up,-7.59%
PSQ,ProShares Short QQQ,$26.0100,-0.0600,-0.22988505747126436%,down,-28.36%
PSQA,Palmer Square Funds Trust Palmer Square CLO Senior Debt ETF,$20.6510,0.0300,0.14513788098693758%,up,1.50%
PSQO,Palmer Square Funds Trust Palmer Square Credit Opportunities E,$20.7648,-0.0400,-0.19267822736030826%,down,1.54%
PSR,Invesco Active U.S. Real Estate Fund,$102.7000,0.1775,0.17310081586559187%,up,13.60%
PST,ProShares UltraShort Lehman 7-10 Year Treasury,$23.2100,-0.0194,-0.0834746090892662%,down,-2.96%
PSTP,Innovator ETFs Trust Innovator Power Buffer Step-Up Strategy E,$36.5451,-0.0080,-0.021935837674801208%,down,13.09%
PSTR,PeakShares Sector Rotation ETF,$30.7982,0.0669,0.21806802809785356%,up,12.93%
PSWD,Xtrackers Cybersecurity Select Equity ETF,$38.0466,-0.0792,-0.21312322397313357%,down,6.76%
PTBD,Pacer Trendpilot US Bond ETF,$19.1100,-0.0350,-0.1831981156765245%,down,-1.62%
PTEU,Pacer TrendpilotTM European Index ETF,$32.4275,0.6127,1.8844943668166594%,up,15.08%
PTF,Invesco Dorsey Wright Technology Momentum ETF,$123.3900,3.6609,3.0067141654518204%,up,92.47%
PTH,Invesco Dorsey Wright Healthcare Momentum ETF,$51.2198,-0.0074,-0.014330670539820865%,down,42.53%
PTIN,Pacer Trendpilot International ETF,$35.9528,0.2738,0.7582597136447976%,up,29.61%
PTIR,GraniteShares 2x Long PLTR Daily ETF,$13.6400,0.0500,0.36310820624546114%,up,-13.58%
PTL,Northern Lights Fund Trust IV Inspire 500 ETF,$280.5300,1.0400,0.373697448796263%,up,28.03%
PTLC,Pacer Fund Trust Pacer Trendpilot US Large Cap ETF,$58.0000,0.0900,0.15581717451523547%,up,20.96%
PTMC,Pacer Trendpilot US Mid Cap ETF,$39.8200,0.0200,0.05067139599695972%,up,13.58%
PTNQ,Pacer Trendpilot 100 ETF,$86.4300,-0.0100,-0.011622501162250115%,down,29.79%
PTRB,PGIM ETF Trust PGIM Total Return Bond ETF,$41.3500,0.0100,0.0242306760358614%,up,1.18%
PUI,Invesco Dorsey Wright Utilities Momentum ETF,$47.6990,0.4203,0.8901832044900985%,up,12.95%
PULS,PGIM Ultra Short Bond ETF,$49.7000,0.0000,0%,unch,0.08%
PULT,Putnam ETF Trust Putnam ESG Ultra Short ETF,$50.3850,0.0000,0%,unch,-0.41%
PUSH,PGIM ETF Trust PGIM Ultra Short Municipal Bond ETF,$50.3600,0.0000,0%,unch,0.33%
PVAL,Putnam Focused Large Cap Value ETF,$50.3600,0.2600,0.5189620758483033%,up,31.46%
PVI,Invesco Floating Rate Municipal Income ETF,$24.8650,-0.0030,-0.012090923746574236%,down,-0.11%
PWB,Invesco Large Cap Growth ETF,$154.7100,1.3700,0.8895526264528278%,up,42.25%
PWER,Nomura Energy Transition ETF,$43.5902,0.1098,0.2551761482345668%,up,63.41%
PWRD,TCW Transform Systems ETF,$111.7373,0.7214,0.6519138107407635%,up,38.51%
PWS,Pacer WealthShield ETF,$31.9563,-0.0686,-0.21460167301712432%,down,10.15%
PWV,Invesco Large Cap Value ETF,$74.5800,0.1800,0.2432103769760843%,up,24.60%
PWZ,Invesco California AMT-Free Municipal Bond Portfolio,$23.9200,0.0100,0.04182350480970305%,up,2.84%
PXE,Invesco Energy Exploration & Production ETF,$37.4100,-0.8200,-2.209051724137931%,down,37.63%
PXF,Invesco RAFI Developed Markets ex-U.S. ETF,$76.4000,0.5690,0.7408854166666666%,up,37.83%
PXH,Invesco RAFI Emerging Markets ETF,$28.6500,-0.0050,-0.017479461632581718%,down,26.18%
PXI,Invesco Dorsey Wright Energy Momentum ETF,$60.2340,-1.1169,-1.869717408008196%,down,45.95%
PXJ,Invesco Oil & Gas Services ETF,$45.4100,-0.8470,-1.8505571334935547%,down,100.04%
PY,Principal Value ETF,$54.6340,-0.0603,-0.11193614256543531%,down,12.77%
PYLD,PIMCO U.S. Treasury Index Fund PIMCO Multisector Bond Active E,$26.3250,0.0400,0.15226494099733537%,up,1.19%
PYPG,Leverage Shares 2X Long PYPL Daily ETF,$5.4850,-0.0168,-0.30499981845248897%,down,-71.69%
PYPY,Tidal Trust II YieldMax PYPL Option Income Strategy ETF,$26.6144,-0.2176,-0.8162101741198358%,down,-60.09%
PYZ,Invesco Dorsey Wright Basic Materials Momentum ETF,$126.5390,0.8951,0.7167376784937859%,up,43.14%
PZA,Invesco National AMT-Free Municipal Bond ETFo,$22.9600,0.0200,0.08722197993894462%,up,2.55%
PZT,Invesco New York AMT-Free Municipal Bond ETF,$22.1614,0.0520,0.23503143545449204%,up,3.05%
QABA,First Trust NASDAQ ABA Community Bank Index Fund,$62.0977,0.1841,0.2965480581820525%,up,17.62%
QAI,NYLI Hedge Multi-Strategy Tracker ETF,$36.1200,0.0600,0.1664355062413315%,up,13.36%
QALT,SEI DBi Multi-Strategy Alternative ETF,$26.1050,0.0555,0.2128842945091195%,up,4.32%
QARP,Xtrackers Russell 1000 US Quality at a Reasonable Price ETF ET,$65.3100,-0.0014,-0.0021536076003888798%,down,25.16%
QAT,iShares MSCI Qatar ETF,$18.6200,0.0096,0.05160014190039022%,up,-3.00%
USCI,United States Commodity Index Fund ETV,$99.5500,-0.4701,-0.4702448354093061%,down,38.96%
USCL,iShares Climate Conscious & Transition MSCI USA ETF,$83.7373,0.0606,0.07277338655637777%,up,19.68%
USD,ProShares Ultra Semiconductors,$95.2000,-0.7800,-0.8197582764056752%,down,256.90%
USDU,WisdomTree Bloomberg U.S. Dollar Bullish Fund,$26.2100,-0.0200,-0.07648183556405354%,down,-0.42%
USDX,SGI Enhanced Core ETF,$25.8400,0.1000,0.3862495171881035%,up,0.98%
USE,USCF ETF Trust USCF Energy Commodity Strategy Absolute Return ,$33.6334,-0.1029,-0.302607897801461%,down,41.13%
USEP,Innovator U.S. Equity Ultra Buffer ETF - September,$41.0061,0.0649,0.15833168658620783%,up,15.78%
USFE,First Eagle ETF Trust First Eagle US Equity ETF,$34.8249,-0.0901,-0.2595053557181904%,down,-0.47%
USFI,BrandywineGLOBAL - U.S. Fixed Income ETF,$24.5450,0.0100,0.040807998367680065%,up,2.17%
USFR,WisdomTree Floating Rate Treasury Fund,$50.4600,0.0100,0.019821605550049554%,up,0.02%
USG,USCF Gold Strategy Plus Income Fund,$35.8646,0.0150,0.04151100041511001%,up,2.74%
USGG,Leverage Shares 2X Long USAR Daily ETF,$18.2550,2.2439,13.269741394094583%,up,28.44%
USHY,iShares Broad USD High Yield Corporate Bond ETF,$36.9900,0.0400,0.1081665765278529%,up,0.82%
USIG,iShares Broad USD Investment Grade Corporate Bond ETF,$51.0000,0.0800,0.15704750687082844%,up,1.94%
USIN,WisdomTree 7-10 Year Laddered Treasury Fund,$49.4097,0.0371,0.07515507063766343%,up,0.58%
USL,United States 12 Month Oil,$53.8300,-0.2900,-0.5359452966180003%,down,60.14%
USMC,Principal U.S. Mega-Cap ETF,$72.9149,0.0692,0.09482439672773613%,up,23.38%
USMF,WisdomTree U.S. Multifactor Fund,$52.9600,0.1300,0.24842346646283203%,up,3.50%
USML,ETRACS 2x Leveraged MSCI US Minimum Volatility Factor TR ETN,$43.6359,0.1326,0.30923940167073233%,up,3.27%
USMV,iShares MSCI USA Min Vol Factor ETF,$96.8800,0.1400,0.1457725947521866%,up,3.27%
USNG,Amplify ETF Trust Amplify Samsung U.S. Natural Gas Infrastruct,$37.5200,0.3000,0.8062348830959419%,up,51.30%
USNZ,DBX ETF Trust Xtrackers Net Zero Pathway Paris Aligned US Equi,$47.1184,0.1799,0.383131154802876%,up,27.66%
USO,United States Oil Fund,$140.9200,-1.7300,-1.2136944015714888%,down,110.89%
USOI,X-Links Crude Oil Shares Covered Call ETN,$55.3100,-0.5362,-0.9606943085760153%,down,2.94%
USOY,Defiance Oil Enhanced Options Income ETF,$8.6302,-0.0548,-0.6315619633740162%,down,-13.83%
USPX,Franklin U.S. Equity Index ETF,$65.1500,0.1600,0.24660912453760792%,up,26.69%
USRD,Themes US R&D Champions ETF,$37.6371,0.1627,0.4398771480171733%,up,22.88%
USRT,iShares Core U.S. REIT ETF,$65.4900,0.1600,0.2447231569287244%,up,17.23%
USSE,Segall Bryant & Hamill Trust Segall Bryant & Hamill Select Equ,$39.2500,0.3400,0.8722421754746025%,up,26.48%
USSG,Xtrackers MSCI USA Selection Equity ETF,$69.0591,-0.1417,-0.20584471144697064%,down,27.88%
USSH,WisdomTree 1-3 Year Laddered Treasury Fund,$50.3900,-0.0250,-0.04960317460317461%,down,-0.28%
UST,ProShares Ultra 7-10 Year Treasury,$41.8398,0.0412,0.09860894373545998%,up,1.21%
USTB,VictoryShares Short-Term Bond ETF,$50.5300,0.0100,0.019786307874950535%,up,0.24%
USVM,VictoryShares US Small Mid Cap Value Momentum ETF,$103.5659,0.2771,0.2693719870631454%,up,28.73%
USVN,US Treasury 7 Year Note ETF,$47.5076,0.0140,0.029489204844655083%,up,0.32%
USXF,iShares ESG Advanced MSCI USA ETF,$66.3508,0.0304,0.045991270735784684%,up,31.46%
UTEN,US Treasury 10 Year Note ETF,$42.9278,0.0521,0.12152056986383167%,up,0.62%
UTES,Virtus Reaves Utilities ETF,$81.5700,1.2400,1.5457491897282474%,up,12.99%
UTHY,US Treasury 30 Year Bond ETF,$40.0272,0.1853,0.4652237115964479%,up,-0.10%
UTRE,US Treasury 3 Year Note ETF,$49.1374,-0.0100,-0.020339672531272248%,down,-0.34%
UTSL,Direxion Daily Utilities Bull 3X ETF,$45.8600,1.2500,2.7901785714285716%,up,22.91%
UTWO,US Treasury 2 Year Note ETF,$48.0950,-0.0400,-0.08315143955929738%,down,-0.34%
UTWY,US Treasury 20 Year Bond ETF,$42.1450,0.1179,0.2809189552388169%,up,-0.14%
UUP,Invesco DB USD Index Bullish Fund ETF,$27.7700,0.0000,0%,unch,0.87%
UUUG,Leverage Shares 2X Long UUUU Daily ETF,$8.9300,1.0000,11.441647597254004%,up,-42.50%
UVIX,VS TR 2x Long VIX Futures ETF,$4.6100,-0.2900,-6.387665198237885%,down,-85.66%
UVXY,ProShares Trust Ultra VIX Short Term Futures ETF,$32.9100,-1.4600,-4.47166921898928%,down,-72.55%
UWM,ProShares Ultra Russell2000,$60.9400,1.1000,1.8391573315499081%,up,78.48%
UX,Roundhill ETF Trust Roundhill Uranium ETF,$29.2700,0.1972,0.6692186566758973%,up,22.20%
UXAP,First Trust Exchange-Traded Fund VIII FT Vest U.S. Equity Unca,$42.8452,0.0721,0.16911345613018688%,up,29.88%
UXI,ProShares Ultra Industrials,$54.9237,-0.4422,-0.8223916682164775%,down,35.27%
UXJA,First Trust Exchange-Traded Fund VIII FT Vest U.S. Equity Unca,$37.9231,0.0719,0.1904782089220099%,up,30.11%
UXJL,First Trust Exchange-Traded Fund VIII FT Vest U.S. Equity Unca,$36.3065,0.0911,0.25211084021264757%,up,19.93%
UXOC,First Trust Exchange-Traded Fund VIII FT Vest U.S. Equity Unca,$39.0805,0.0978,0.25152509592930544%,up,29.46%
UXRP,ProShares Trust ProShares Ultra XRP ETF,$3.4500,0.0100,0.2717391304347826%,up,-90.34%
UYG,ProShares Ultra Financials,$80.2836,0.3849,0.48230121208096244%,up,-9.58%
UYLD,Angel Oak UltraShort Income ETF,$51.1490,0.0031,0.006061423730669435%,up,0.08%
UYM,ProShares Ultra Materials,$29.1881,0.4118,1.42294402211472%,up,26.82%
VABS,Virtus Newfleet ABS/MBS ETF,$24.1000,0.0000,0%,unch,-0.72%
VALG,Leverage Shares 2X Long VALE Daily ETF,$22.1756,0.3243,1.456892950039758%,up,49.14%
VALQ,American Century U.S. Quality Value ETF,$69.0233,0.6023,0.8870881034754471%,up,12.28%
VAMO,Cambria ETF Trust Cambria Value and Momentum ETF,$35.0998,-0.0256,-0.07320330215520816%,down,18.78%
VAVX,VanEck Avalanche ETF,$19.2259,0.3742,1.890853966649823%,up,-17.75%
VAW,Vanguard Materials ETF,$227.7800,1.6000,0.706058867658091%,up,19.51%
VB,Vanguard Small-Cap ETF,$289.0900,1.7800,0.6213998952696806%,up,26.28%
VBCA,Vanguard Target Maturity 2027 Corporate Bond ETF,$75.5519,0.0050,0.006619009796134498%,up,0.72%
VBCB,Vanguard Target Maturity 2028 Corporate Bond ETF,$75.4848,-0.0100,-0.013245033112582781%,down,0.76%
VBCC,Vanguard Target Maturity 2029 Corporate Bond ETF,$75.3800,0.0100,0.013259082471492972%,up,0.75%
VBCD,Vanguard Target Maturity 2030 Corporate Bond ETF,$75.2813,0.0347,0.04608233731739708%,up,0.71%
VBCE,Vanguard Target Maturity 2031 Corporate Bond ETF,$75.3424,0.0441,0.05852687458526875%,up,0.84%
VBCF,Vanguard Target Maturity 2032 Corporate Bond ETF,$75.3273,0.0394,0.05231014338821031%,up,0.88%
VBCG,Vanguard Target Maturity 2033 Corporate Bond ETF,$75.1621,0.0727,0.09683649683649684%,up,0.44%
VBCH,Vanguard Target Maturity 2034 Corporate Bond ETF,$75.2513,0.0994,0.13225119744544972%,up,0.59%
VBCI,Vanguard Target Maturity 2035 Corporate Bond ETF,$75.2928,0.0920,0.12238111074160292%,up,0.66%
VBCJ,Vanguard Target Maturity 2036 Corporate Bond ETF,$75.1254,0.1220,0.1626124625124958%,up,0.46%
VBIL,Vanguard 0-3 Month Treasury Bill ETF,$75.6300,0.0200,0.026451527575717497%,up,0.23%
VBK,Vanguard Small-Cap Growth ETF,$347.1200,3.2200,0.9372453137734311%,up,31.05%
VBND,Vident U.S. Bond Strategy ETF,$43.2000,0.0058,0.013409226472587379%,up,1.46%
VBR,Vanguard Small-Cap Value ETF,$232.6700,0.8700,0.3769987433375222%,up,22.82%
VCEB,Vanguard ESG U.S. Corporate Bond ETF,$62.5200,0.0660,0.10577601128277454%,up,1.18%
VCIT,Vanguard Intermediate-Term Corporate Bond ETF,$82.2200,0.0500,0.060871682493304116%,up,2.01%
VCLN,Virtus Duff & Phelps Clean Energy ETF,$34.2750,1.2350,3.6419935122382787%,up,82.68%
VCLT,Vanguard Long-Term Corporate Bond ETF,$74.4800,0.2500,0.3370180641682394%,up,3.23%
VCR,Vanguard Consumer Discretion ETF,$394.7500,3.2900,0.8374484549203278%,up,11.85%
VCRB,Vanguard Core Bond ETF,$76.7988,0.1134,0.14782293575828995%,up,1.26%
VCRM,Vanguard Tax-Managed Funds Vanguard Core Tax-Exempt Bond ETF,$75.2200,-0.0150,-0.01997469871496105%,down,3.01%
VCSH,Vanguard Short-Term Corporate Bond ETF,$78.8700,0.0200,0.025348542458808618%,up,0.36%
VDC,Vanguard Consumer Staples ETF,$229.6900,-3.3600,-1.4622682565932632%,down,4.08%
VDE,Vanguard Energy ETF,$168.0200,-1.8900,-1.129842180774749%,down,45.93%
VEA,Vanguard FTSE Developed Markets ETF,$70.4600,0.4900,0.6931673504031688%,up,28.76%
VEGA,AdvisorShares STAR Global Buy-Write ETF,$52.0073,0.1243,0.23946858395656814%,up,17.47%
VEGI,iShares MSCI Agriculture Producers ETF,$43.8400,-0.5800,-1.3214855320118477%,down,9.64%
VEGN,US Vegan Climate ETF,$73.8480,0.7709,1.0517928504282077%,up,39.40%
VEMY,Virtus ETF Trust II Virtus Stone Harbor Emerging Markets High ,$28.4324,-0.0132,-0.04649524480450863%,down,8.32%
VERS,ProShares Trust ProShares Metaverse ETF,$78.7799,2.0357,2.656143171035944%,up,57.89%
VETZ,Academy Veteran Bond ETF,$19.6350,0.0200,0.10185892538833714%,up,0.67%
VEU,Vanguard FTSE All World Ex US ETF,$82.4400,0.4400,0.5328166626301768%,up,27.01%
VFH,Vanguard Financials ETF,$127.3700,0.2500,0.19683489489016612%,up,4.82%
VFLO,VictoryShares Free Cash Flow ETF,$44.1800,0.2500,0.5772338951743246%,up,27.65%
VFMF,Vanguard U.S. Multifactor ETF,$170.6463,0.2648,0.15630386226371434%,up,30.75%
VFMO,Vanguard U.S. Momentum Factor ETF,$229.6300,1.5400,0.674669236835188%,up,41.19%
VFMV,Vanguard U.S. Minimum Volatility ETF,$142.0965,0.1699,0.12100277757994445%,up,11.49%
VFQY,Vanguard U.S. Quality Factor ETF,$162.9293,0.4812,0.2983423770174691%,up,16.71%
VFVA,Vanguard U.S. Value Factor ETF,$144.5143,0.3116,0.21753457096262538%,up,26.48%
VGHY,Vanguard High-Yield Active ETF,$74.6100,0.0800,0.10723860589812333%,up,-0.75%
VGIT,Vanguard Intermediate-Term Treasury ETF,$58.7300,0.0300,0.05106382978723404%,up,0.12%
VGK,Vanguard FTSEEuropean ETF,$88.4600,0.5200,0.5858494817485354%,up,16.22%
VGLT,Vanguard Long-Term Treasury ETF,$54.1300,0.1800,0.333889816360601%,up,0.69%
VGMS,Vanguard Malvern Funds Vanguard Multi-Sector Income Bond ETF,$51.0747,0.0650,0.12726382770435632%,up,1.37%
VGSH,Vanguard Short-Term Treasury ETF,$58.2200,-0.0100,-0.017173278378842523%,down,-0.41%
VGSR,Vert Global Sustainable Real Estate ETF,$11.2650,0.0391,0.34619845760175666%,up,10.73%
VGT,Vanguard Information Tech ETF,$115.7500,0.6600,0.5764695606603197%,up,52.35%
VGUS,Vanguard Ultra-Short Treasury ETF,$75.6700,-0.0100,-0.013228388120907467%,down,0.22%
VGVT,Vanguard Malvern Funds Vanguard Government Securities Active E,$74.8450,0.0696,0.09311472777989604%,up,-0.77%
VHT,Vanguard Health Care ETF,$279.2700,1.7700,0.6400520720329789%,up,14.59%
VICE,AdvisorShares Trust AdvisorShares Vice ETF,$32.9334,-0.1263,-0.38266001733028737%,down,0.38%
VIDI,Vident International Equity Strategy ETF,$40.3700,0.3388,0.843835616438356%,up,40.31%
VIG,Vanguard Div Appreciation ETF,$233.1000,0.3500,0.15148236312486474%,up,18.12%
VIGI,Vanguard International Dividend Appreciation ETF,$93.8836,0.0105,0.011176157530601383%,up,6.40%
VIOG,Vanguard S&P Small-Cap 600 Growth ETF,$139.1200,0.1000,0.07245326764237067%,up,25.75%
VIOO,Vanguard S&P Small-Cap 600 ETF,$127.0200,0.3400,0.27001270648030495%,up,30.31%
VIOV,Vanguard S&P Small-Cap 600 Value ETF,$111.1500,0.5500,0.4992284650993919%,up,34.91%
VIS,Vanguard Industrials ETF,$336.0900,-0.1500,-0.045001800072002884%,down,24.88%
VIXM,ProShares Trust VIX Mid-Term Futures ETF,$15.7300,-0.1700,-1.0869565217391304%,down,-7.67%
VIXY,ProShares Trust VIX Short-Term Futures ETF,$25.4300,-0.7300,-2.8865164096480824%,down,-53.47%
VLLU,Harbor ETF Trust Harbor AlphaEdge Large Cap Value ETF,$25.6848,0.1723,0.6823302985541568%,up,20.31%
VLU,State Street SPDR S&P 1500 Value Tilt ETF,$235.7492,0.4495,0.19217031034970722%,up,26.93%
VLUE,iShares MSCI USA Value Factor ETF,$187.3300,2.2300,1.2059268873026174%,up,72.82%
VMAX,Lattice Strategies Trust Hartford US Value ETF,$60.5655,0.2820,0.46848056137925986%,up,24.66%
VMBS,Vanguard Mortgage-Backed Securities ETF,$46.5700,0.0300,0.06451612903225806%,up,2.99%
VNAM,Global X Funds Global X MSCI Vietnam ETF,$25.8000,-0.6200,-2.3892100192678227%,down,55.03%
VNIE,The Advisors Inner Circle Fund II Vontobel International Equit,$26.0421,-0.0321,-0.12528980585934754%,down,-0.59%
VNLA,Janus Henderson Short Duration Income ETF,$49.0300,0.0100,0.020403999183840033%,up,-0.06%
VNM,VanEck Vietnam ETF,$18.7500,-0.3300,-1.738672286617492%,down,43.68%
VNQ,Vanguard Real Estate ETF,$96.7700,0.1800,0.1862004758456605%,up,10.61%
VNQI,Vanguard Global ex-U.S. Real Estate ETF,$45.6100,0.0900,0.19522776572668113%,up,6.34%
VNSE,Natixis Vaughan Nelson Select ETF,$41.3220,0.0743,0.18080146393217636%,up,23.74%
VO,Vanguard Mid-Cap ETF,$78.0800,0.3500,0.4521379666709728%,up,15.72%
VOE,Vanguard Mid-Cap Value ETF,$194.3700,0.1500,0.07787353338178797%,up,20.09%
VOLT,Tema Electrification ETF,$39.5900,0.4000,1.0238034297414895%,up,66.89%
VONE,Vanguard Russell 1000 ETF,$336.3200,0.7609,0.22710321182858825%,up,26.53%
VONG,Vanguard Russell 1000 Growth ETF,$128.6200,0.0300,0.023379052369077308%,up,26.74%
VONV,Vanguard Russell 1000 Value ETF,$103.6800,0.4300,0.4176784847013113%,up,25.26%
VOO,Vanguard S&P 500 ETF,$685.5500,1.2700,0.1859879327514498%,up,27.45%
VOOG,Vanguard S&P 500 Growth ETF,$82.1100,0.1700,0.20701412566975158%,up,33.97%
VOOV,Vanguard S&P 500 Value ETF,$220.1600,0.1900,0.08703220191470844%,up,20.12%
VOT,Vanguard Mid-Cap Growth ETF,$291.2000,2.6400,0.9138742730545555%,up,9.12%
VOTE,TCW Transform 500 ETF,$87.7053,0.1723,0.19725853002897628%,up,27.30%
VOX,Vanguard Communication Services  ETF,$195.5500,0.6400,0.32671397212721426%,up,24.27%
VOXP,Advisors Series Trust Vox Populi ETF,$38.5407,0.0877,0.2284401471185805%,up,26.14%
VPC,Virtus Private Credit Strategy ETF,$15.5200,-0.0060,-0.038461538461538464%,down,-23.57%
VPL,Vanguard FTSE Pacific ETF,$111.9100,1.0000,0.8892841262783459%,up,45.28%
VPLS,Vanguard Core Plus Bond ETF,$77.1269,0.0618,0.08022848240945085%,up,1.46%
VPU,Vanguard Utilities ETF,$196.4700,2.0100,1.0311393833683884%,up,11.08%
VRAI,Virtus Real Asset Income ETF,$28.1351,-0.0119,-0.04245920883151544%,down,24.90%
VRIG,Invesco Variable Rate Investment Grade ETF,$25.0450,-0.0050,-0.019972039145196723%,down,0.14%
VRP,Invesco Variable Rate Preferred ETF,$24.2600,0.0000,0%,unch,0.71%
VRTL,GraniteShares 2x Long VRT Daily ETF,$161.3700,6.8600,4.356938710701811%,up,493.03%
VSDA,VictoryShares Dividend Accelerator ETF,$55.4420,0.2717,0.49274663174942285%,up,8.95%
VSDB,Vanguard Malvern Funds Vanguard Short Duration Bond ETF,$76.0400,0.0000,0%,unch,1.14%
VSDM,Vanguard Tax-Managed Funds Vanguard Short Duration Tax-Exempt ,$76.1388,0.0200,0.02627430373095113%,up,1.55%
VSGX,Vanguard ESG International Stock ETF,$80.2100,0.5600,0.6978193146417446%,up,26.50%
VSHY,Virtus Newfleet Short Duration High Yield Bond ETF,$21.6700,0.0097,0.044762963954277174%,up,0.63%
VSLU,Applied Finance Valuation Large Cap ETF,$46.6576,0.0800,0.1720800172080017%,up,26.30%
VSMV,VictoryShares US Multi-Factor Minimum Volatility ETF,$60.6215,-0.4867,-0.8134728622310918%,down,23.11%
VSOL,VanEck Solana ETF,$11.2334,0.2150,1.8441164109206%,up,-30.80%
VSS,Vanguard FTSE All-Wld ex-US SmCp Idx ETF,$159.3400,0.6700,0.42210042210042215%,up,25.82%
VSTL,Defiance Daily Target 2X Long VST ETF,$29.1100,1.8100,6.804511278195489%,up,-56.03%
